{
  "schema_version": "1.0.0",
  "source_type": "qiskit_aer",
  "backend_name": "AerSimulator",
  "ibm_job_id": null,
  "timestamp": "2026-10-10T04:06:15.433036+00:00",
  "shots_per_context": 1000,
  "contexts": [
    {
      "row": 0,
      "column": 0,
      "shots": 1000,
      "wins": 1000,
      "win_rate": 1.0,
      "confidence_interval_95": [
        0.9962,
        1.0
      ],
      "alice_parity_valid_count": 1000,
      "bob_parity_valid_count": 1000,
      "shared_cell_match_count": 1000,
      "counts": [
        {
          "alice_bits": [
            0,
            0,
            0
          ],
          "bob_bits": [
            0,
            1,
            0
          ],
          "count": 127,
          "win": true,
          "alice_parity_even": true,
          "bob_parity_odd": true,
          "shared_match": true
        },
        {
          "alice_bits": [
            1,
            1,
            0
          ],
          "bob_bits": [
            1,
            1,
            1
          ],
          "count": 138,
          "win": true,
          "alice_parity_even": true,
          "bob_parity_odd": true,
          "shared_match": true
        },
        {
          "alice_bits": [
            1,
            1,
            0
          ],
          "bob_bits": [
            1,
            0,
            0
          ],
          "count": 128,
          "win": true,
          "alice_parity_even": true,
          "bob_parity_odd": true,
          "shared_match": true
        },
        {
          "alice_bits": [
            1,
            0,
            1
          ],
          "bob_bits": [
            1,
            1,
            1
          ],
          "count": 118,
          "win": true,
          "alice_parity_even": true,
          "bob_parity_odd": true,
          "shared_match": true
        },
        {
          "alice_bits": [
            1,
            0,
            1
          ],
          "bob_bits": [
            1,
            0,
            0
          ],
          "count": 113,
          "win": true,
          "alice_parity_even": true,
          "bob_parity_odd": true,
          "shared_match": true
        },
        {
          "alice_bits": [
            0,
            0,
            0
          ],
          "bob_bits": [
            0,
            0,
            1
          ],
          "count": 126,
          "win": true,
          "alice_parity_even": true,
          "bob_parity_odd": true,
          "shared_match": true
        },
        {
          "alice_bits": [
            0,
            1,
            1
          ],
          "bob_bits": [
            0,
            0,
            1
          ],
          "count": 114,
          "win": true,
          "alice_parity_even": true,
          "bob_parity_odd": true,
          "shared_match": true
        },
        {
          "alice_bits": [
            0,
            1,
            1
          ],
          "bob_bits": [
            0,
            1,
            0
          ],
          "count": 136,
          "win": true,
          "alice_parity_even": true,
          "bob_parity_odd": true,
          "shared_match": true
        }
      ]
    },
    {
      "row": 0,
      "column": 1,
      "shots": 1000,
      "wins": 1000,
      "win_rate": 1.0,
      "confidence_interval_95": [
        0.9962,
        1.0
      ],
      "alice_parity_valid_count": 1000,
      "bob_parity_valid_count": 1000,
      "shared_cell_match_count": 1000,
      "counts": [
        {
          "alice_bits": [
            1,
            1,
            0
          ],
          "bob_bits": [
            1,
            1,
            1
          ],
          "count": 137,
          "win": true,
          "alice_parity_even": true,
          "bob_parity_odd": true,
          "shared_match": true
        },
        {
          "alice_bits": [
            1,
            0,
            1
          ],
          "bob_bits": [
            0,
            0,
            1
          ],
          "count": 122,
          "win": true,
          "alice_parity_even": true,
          "bob_parity_odd": true,
          "shared_match": true
        },
        {
          "alice_bits": [
            0,
            1,
            1
          ],
          "bob_bits": [
            1,
            0,
            0
          ],
          "count": 116,
          "win": true,
          "alice_parity_even": true,
          "bob_parity_odd": true,
          "shared_match": true
        },
        {
          "alice_bits": [
            0,
            0,
            0
          ],
          "bob_bits": [
            0,
            0,
            1
          ],
          "count": 126,
          "win": true,
          "alice_parity_even": true,
          "bob_parity_odd": true,
          "shared_match": true
        },
        {
          "alice_bits": [
            1,
            0,
            1
          ],
          "bob_bits": [
            0,
            1,
            0
          ],
          "count": 134,
          "win": true,
          "alice_parity_even": true,
          "bob_parity_odd": true,
          "shared_match": true
        },
        {
          "alice_bits": [
            0,
            1,
            1
          ],
          "bob_bits": [
            1,
            1,
            1
          ],
          "count": 117,
          "win": true,
          "alice_parity_even": true,
          "bob_parity_odd": true,
          "shared_match": true
        },
        {
          "alice_bits": [
            0,
            0,
            0
          ],
          "bob_bits": [
            0,
            1,
            0
          ],
          "count": 117,
          "win": true,
          "alice_parity_even": true,
          "bob_parity_odd": true,
          "shared_match": true
        },
        {
          "alice_bits": [
            1,
            1,
            0
          ],
          "bob_bits": [
            1,
            0,
            0
          ],
          "count": 131,
          "win": true,
          "alice_parity_even": true,
          "bob_parity_odd": true,
          "shared_match": true
        }
      ]
    },
    {
      "row": 0,
      "column": 2,
      "shots": 1000,
      "wins": 1000,
      "win_rate": 1.0,
      "confidence_interval_95": [
        0.9962,
        1.0
      ],
      "alice_parity_valid_count": 1000,
      "bob_parity_valid_count": 1000,
      "shared_cell_match_count": 1000,
      "counts": [
        {
          "alice_bits": [
            0,
            0,
            0
          ],
          "bob_bits": [
            0,
            1,
            0
          ],
          "count": 135,
          "win": true,
          "alice_parity_even": true,
          "bob_parity_odd": true,
          "shared_match": true
        },
        {
          "alice_bits": [
            0,
            0,
            0
          ],
          "bob_bits": [
            0,
            0,
            1
          ],
          "count": 145,
          "win": true,
          "alice_parity_even": true,
          "bob_parity_odd": true,
          "shared_match": true
        },
        {
          "alice_bits": [
            1,
            1,
            0
          ],
          "bob_bits": [
            0,
            1,
            0
          ],
          "count": 120,
          "win": true,
          "alice_parity_even": true,
          "bob_parity_odd": true,
          "shared_match": true
        },
        {
          "alice_bits": [
            1,
            1,
            0
          ],
          "bob_bits": [
            0,
            0,
            1
          ],
          "count": 128,
          "win": true,
          "alice_parity_even": true,
          "bob_parity_odd": true,
          "shared_match": true
        },
        {
          "alice_bits": [
            1,
            0,
            1
          ],
          "bob_bits": [
            1,
            0,
            0
          ],
          "count": 125,
          "win": true,
          "alice_parity_even": true,
          "bob_parity_odd": true,
          "shared_match": true
        },
        {
          "alice_bits": [
            1,
            0,
            1
          ],
          "bob_bits": [
            1,
            1,
            1
          ],
          "count": 107,
          "win": true,
          "alice_parity_even": true,
          "bob_parity_odd": true,
          "shared_match": true
        },
        {
          "alice_bits": [
            0,
            1,
            1
          ],
          "bob_bits": [
            1,
            0,
            0
          ],
          "count": 108,
          "win": true,
          "alice_parity_even": true,
          "bob_parity_odd": true,
          "shared_match": true
        },
        {
          "alice_bits": [
            0,
            1,
            1
          ],
          "bob_bits": [
            1,
            1,
            1
          ],
          "count": 132,
          "win": true,
          "alice_parity_even": true,
          "bob_parity_odd": true,
          "shared_match": true
        }
      ]
    },
    {
      "row": 1,
      "column": 0,
      "shots": 1000,
      "wins": 1000,
      "win_rate": 1.0,
      "confidence_interval_95": [
        0.9962,
        1.0
      ],
      "alice_parity_valid_count": 1000,
      "bob_parity_valid_count": 1000,
      "shared_cell_match_count": 1000,
      "counts": [
        {
          "alice_bits": [
            0,
            1,
            1
          ],
          "bob_bits": [
            0,
            0,
            1
          ],
          "count": 118,
          "win": true,
          "alice_parity_even": true,
          "bob_parity_odd": true,
          "shared_match": true
        },
        {
          "alice_bits": [
            1,
            0,
            1
          ],
          "bob_bits": [
            0,
            1,